{
  "schema_version": "1.0.0",
  "manifest_id": "legacy-champions-59bf57c-sim01",
  "source_kind": "legacy_project",
  "title": "Legacy champions-derived SIM-01 catalog fixture lineage",
  "publisher": "unknown",
  "locator": {
    "kind": "logical",
    "value": "legacy://champions@59bf57cc3cdcb2eaa93cbab19eb9851a6fb15c1b"
  },
  "retrieved_on": "2026-07-13",
  "license_status": "unverified",
  "license": {
    "identifier": null,
    "url": null,
    "redistribution_allowed": false,
    "commercial_use_allowed": false,
    "notes": "Operational restriction: license is unverified, so this project treats redistribution and commercial use as prohibited until source-by-source review is complete."
  },
  "usage_policy": {
    "local_research_only": true,
    "redistribution": "prohibited",
    "derivative_distribution": "review_required"
  },
  "artifacts": [
    {
      "artifact_id": "sim01-catalog-fixture-v1",
      "logical_path": "data/fixtures/sim01_catalog.json",
      "media_type": "application/json",
      "byte_size": 10286,
      "sha256": "sha256:764a75146a017aca77453110fc8e19903ddc11e64e1df03c92791aa367703141",
      "record_count": null
    },
    {
      "artifact_id": "legacy-pokemon-json-59bf57c",
      "logical_path": "legacy/champions@59bf57c/data/processed/pokemon.json",
      "media_type": "application/json",
      "byte_size": 889882,
      "sha256": "sha256:e89c4f8f79bc5ca8dfc28d6afae40c7c35e8aee522e54341972e52977f72583e",
      "record_count": 275
    },
    {
      "artifact_id": "legacy-moves-json-59bf57c",
      "logical_path": "legacy/champions@59bf57c/data/processed/moves.json",
      "media_type": "application/json",
      "byte_size": 549774,
      "sha256": "sha256:09bf9109858a475f6b9976a9b518ab2203837a2b8566c9fc9261afb5ae8c16cf",
      "record_count": 490
    },
    {
      "artifact_id": "legacy-types-json-59bf57c",
      "logical_path": "legacy/champions@59bf57c/data/processed/types.json",
      "media_type": "application/json",
      "byte_size": 31269,
      "sha256": "sha256:d579fdb4fee1e71414ee046f04e5ce01978e3d5569fbc0cff121ab1e969bf02a",
      "record_count": null
    },
    {
      "artifact_id": "legacy-abilities-json-59bf57c",
      "logical_path": "legacy/champions@59bf57c/data/processed/abilities.json",
      "media_type": "application/json",
      "byte_size": 242092,
      "sha256": "sha256:a239274f576ff8d5def38597e809891643e1634427986e6f17eda7fc5294ddce",
      "record_count": 310
    },
    {
      "artifact_id": "legacy-items-json-59bf57c",
      "logical_path": "legacy/champions@59bf57c/data/processed/items.json",
      "media_type": "application/json",
      "byte_size": 58325,
      "sha256": "sha256:c9b2e9fe09a08e593b8972360126bfbe8a1069be69e371111d793e4fd2e7ddc6",
      "record_count": 117
    },
    {
      "artifact_id": "legacy-damage-calculator-py-59bf57c",
      "logical_path": "legacy/champions@59bf57c/src/champions/damage/calculator.py",
      "media_type": "text/x-python",
      "byte_size": 22762,
      "sha256": "sha256:ba842102e6fc37d94ae4d4de358225dee5a6f1754548e9c79d8a01546fd93992",
      "record_count": null
    }
  ],
  "scope": {
    "regulation_ids": [],
    "entity_types": [
      "pokemon",
      "move",
      "ability",
      "item",
      "type_chart",
      "mechanics"
    ],
    "language": "ja"
  },
  "processing": {
    "retrieval_method": "manual_reference",
    "parser_version": "manual-selection-v1",
    "normalized_artifact_ids": [
      "sim01-catalog-fixture-v1"
    ]
  },
  "trust": {
    "authority": "local_unknown",
    "verification_status": "unverified"
  },
  "derivation_status": "derived",
  "parent_manifest_ids": [],
  "notes": "This manifest records the exact legacy commit, six inspected legacy source artifacts, and the current fixture hash. The six legacy files are not copied into this repository. license_status remains unverified; the fixture is restricted to local research, cannot be redistributed, and is not an authoritative Champions catalog."
}
