{
  "schema_version": "1.0.0",
  "manifest_id": "champions-wiki-damage-reference",
  "source_kind": "secondary_reference",
  "title": "Champions Wiki damage formula worked example",
  "publisher": "Champions Wiki community",
  "locator": {
    "kind": "url",
    "value": "https://champions.pokewiki.net/%E3%83%80%E3%83%A1%E3%83%BC%E3%82%B8%E8%A8%88%E7%AE%97%E5%BC%8F"
  },
  "retrieved_on": "2026-07-13",
  "license_status": "unverified",
  "license": {
    "identifier": null,
    "url": null,
    "redistribution_allowed": false,
    "commercial_use_allowed": false,
    "notes": "The worked example is retained only as a small factual local validation case; source licensing was not verified."
  },
  "usage_policy": {
    "local_research_only": true,
    "redistribution": "prohibited",
    "derivative_distribution": "review_required"
  },
  "artifacts": [
    {
      "artifact_id": "sim01-damage-golden-reference",
      "logical_path": "data/golden/sim01_damage_reference.json",
      "media_type": "application/json",
      "byte_size": 754,
      "sha256": "sha256:545deddd37cee1732d98007ffc7c70ae98f9e656670831293215a2b274ee7ed9",
      "record_count": 1
    }
  ],
  "scope": {
    "regulation_ids": [],
    "entity_types": ["mechanics"],
    "language": "ja"
  },
  "processing": {
    "retrieval_method": "manual_reference",
    "parser_version": "clean-room-golden-v1",
    "normalized_artifact_ids": ["sim01-damage-golden-reference"]
  },
  "trust": {
    "authority": "community",
    "verification_status": "partially_verified"
  },
  "derivation_status": "summary",
  "parent_manifest_ids": [],
  "notes": "This is published Champions-specific reference grounding, not a BlueStacks/device capture. It validates one ordinary-damage boundary only."
}
